[
  {
    "id": "archetype_freeze_burst_v1",
    "category": "archetype_profile",
    "availability": ["LAUNCH", "EXPANSION"],
    "name_key": "ARCHETYPE_FREEZE_BURST_NAME",
    "description_key": "ARCHETYPE_FREEZE_BURST_DESC",
    "tags": ["build_route", "control", "time_stop"],
    "compatibility": {},
    "effects": {},
    "references": [],
    "profile_version": 1,
    "archetype_id": "freeze_burst",
    "mechanic_tags": ["stop", "slow", "weakpoint", "burst"],
    "starter_min": 3,
    "payoff_min": 2,
    "risk_min": 1,
    "boss_conversion_id": "boss_weakpoint_exposure",
    "boss_response_key": "ARCHETYPE_FREEZE_BURST_BOSS_RESPONSE"
  },
  {
    "id": "archetype_rewind_echo_v1",
    "category": "archetype_profile",
    "availability": ["LAUNCH", "EXPANSION"],
    "name_key": "ARCHETYPE_REWIND_ECHO_NAME",
    "description_key": "ARCHETYPE_REWIND_ECHO_DESC",
    "tags": ["build_route", "echo", "rewind"],
    "compatibility": {},
    "effects": {},
    "references": [],
    "profile_version": 1,
    "archetype_id": "rewind_echo",
    "mechanic_tags": ["rewind", "path", "echo", "bait"],
    "starter_min": 3,
    "payoff_min": 2,
    "risk_min": 1,
    "boss_conversion_id": "boss_rewind_path_strike",
    "boss_response_key": "ARCHETYPE_REWIND_ECHO_BOSS_RESPONSE"
  },
  {
    "id": "archetype_rift_trap_v1",
    "category": "archetype_profile",
    "availability": ["LAUNCH", "EXPANSION"],
    "name_key": "ARCHETYPE_RIFT_TRAP_NAME",
    "description_key": "ARCHETYPE_RIFT_TRAP_DESC",
    "tags": ["build_route", "rift", "zone_control"],
    "compatibility": {},
    "effects": {},
    "references": [],
    "profile_version": 1,
    "archetype_id": "rift_trap",
    "mechanic_tags": ["rift", "zone", "projectile_control", "trap"],
    "starter_min": 3,
    "payoff_min": 2,
    "risk_min": 1,
    "boss_conversion_id": "boss_projectile_window",
    "boss_response_key": "ARCHETYPE_RIFT_TRAP_BOSS_RESPONSE"
  },
  {
    "id": "archetype_accelerated_combo_v1",
    "category": "archetype_profile",
    "availability": ["LAUNCH", "EXPANSION"],
    "name_key": "ARCHETYPE_ACCELERATED_COMBO_NAME",
    "description_key": "ARCHETYPE_ACCELERATED_COMBO_DESC",
    "tags": ["build_route", "combo", "tempo"],
    "compatibility": {},
    "effects": {},
    "references": [],
    "profile_version": 1,
    "archetype_id": "accelerated_combo",
    "mechanic_tags": ["accelerate", "combo", "tempo", "armor_break"],
    "starter_min": 3,
    "payoff_min": 2,
    "risk_min": 1,
    "boss_conversion_id": "boss_combo_break",
    "boss_response_key": "ARCHETYPE_ACCELERATED_COMBO_BOSS_RESPONSE"
  },
  {
    "id": "archetype_low_hp_void_v1",
    "category": "archetype_profile",
    "availability": ["LAUNCH", "EXPANSION"],
    "name_key": "ARCHETYPE_LOW_HP_VOID_NAME",
    "description_key": "ARCHETYPE_LOW_HP_VOID_DESC",
    "tags": ["build_route", "health_risk", "void"],
    "compatibility": {},
    "effects": {},
    "references": [],
    "profile_version": 1,
    "archetype_id": "low_hp_void",
    "mechanic_tags": ["low_health", "void", "execute", "lifesteal"],
    "starter_min": 3,
    "payoff_min": 2,
    "risk_min": 1,
    "boss_conversion_id": "boss_execute_warning",
    "boss_response_key": "ARCHETYPE_LOW_HP_VOID_BOSS_RESPONSE"
  },
  {
    "id": "archetype_perfect_guard_v1",
    "category": "archetype_profile",
    "availability": ["LAUNCH", "EXPANSION"],
    "name_key": "ARCHETYPE_PERFECT_GUARD_NAME",
    "description_key": "ARCHETYPE_PERFECT_GUARD_DESC",
    "tags": ["build_route", "counter", "defense"],
    "compatibility": {},
    "effects": {},
    "references": [],
    "profile_version": 1,
    "archetype_id": "perfect_guard",
    "mechanic_tags": ["guard", "parry", "counter", "ward"],
    "starter_min": 3,
    "payoff_min": 2,
    "risk_min": 1,
    "boss_conversion_id": "boss_counter_window",
    "boss_response_key": "ARCHETYPE_PERFECT_GUARD_BOSS_RESPONSE"
  },
  {
    "id": "archetype_piercing_barrage_v1",
    "category": "archetype_profile",
    "availability": ["LAUNCH", "EXPANSION"],
    "name_key": "ARCHETYPE_PIERCING_BARRAGE_NAME",
    "description_key": "ARCHETYPE_PIERCING_BARRAGE_DESC",
    "tags": ["build_route", "pierce", "projectile"],
    "compatibility": {},
    "effects": {},
    "references": [],
    "profile_version": 1,
    "archetype_id": "piercing_barrage",
    "mechanic_tags": ["pierce", "projectile", "weakpoint", "ammo"],
    "starter_min": 3,
    "payoff_min": 2,
    "risk_min": 1,
    "boss_conversion_id": "boss_weakpoint_ammo_refund",
    "boss_response_key": "ARCHETYPE_PIERCING_BARRAGE_BOSS_RESPONSE"
  },
  {
    "id": "archetype_echo_legion_v1",
    "category": "archetype_profile",
    "availability": ["LAUNCH", "EXPANSION"],
    "name_key": "ARCHETYPE_ECHO_LEGION_NAME",
    "description_key": "ARCHETYPE_ECHO_LEGION_DESC",
    "tags": ["build_route", "echo", "summon"],
    "compatibility": {},
    "effects": {},
    "references": [],
    "profile_version": 1,
    "archetype_id": "echo_legion",
    "mechanic_tags": ["echo", "summon", "aggro", "repeat_action"],
    "starter_min": 3,
    "payoff_min": 2,
    "risk_min": 1,
    "boss_conversion_id": "boss_facing_lure",
    "boss_response_key": "ARCHETYPE_ECHO_LEGION_BOSS_RESPONSE"
  }
]
